gate,status,why_it_matters_for_chris,blocking_input,current_artifact,owner_placeholder,decision_needed,board_use_rule
Appfigures performance gate,Blocked / credentialed export required,"The brief explicitly asks for Appfigures where possible; without it, app-based success cannot be ranked by revenue, downloads, ranks, review velocity or country mix.",Credentialed Appfigures export for 16 request-pack rows.,appfigures_request_pack_v3_2.csv and appfigures-performance-export-integrated-v3.csv,Yousician Appfigures credential owner,"Export now, accept caveat, or remove performance ranking from executive-facing claims.",No app revenue/download/rank conclusion without credentialed export.
Internal relationship gate,Blocked / Yousician owner input required,"Relationship fields are part of the brief, but external research cannot infer relationship status safely.","Owner, confirmed relationship, sensitivity, last contact and suggested next step.",relationships_template_v3.csv,Yousician relationship owners,Assign owners and fill internal relationship fields.,Never write 'no relationship' unless internally confirmed.
Creator reach gate,Partially complete / platform export required,Influencers and creator educators are named in the brief; names alone are not enough for a strategic layer.,"YouTube, TikTok, Instagram and average-view exports or validated public source snapshots.",influencers_creators_v3.csv,Creator / social research owner,Validate reach fields or present creator layer as directional.,Use only public proxy reach unless platform export is added.
Private-company ownership and funding gate,Partially complete / paid database or direct validation required,"Ownership, investors and funding are high-risk claims if based only on incomplete public pages.","Crunchbase, PitchBook, Dealroom, filings, official press releases or direct company validation.",claim_source_matrix_v3_2.csv and source_audit_v3.csv,Research owner TBD,Validate hard claims before board/investor excerpts.,Claims marked Pending/Low remain caveated in main narrative.
Awards/funding execution gate,Prepared / owner decision required,"The tracker is only useful if someone can decide submit, monitor or deprioritize.","Owner, eligibility check, next deadline, effort estimate and submit/no-submit decision.",awards_v3.csv and funding_v3.csv,Partnerships / strategy owner TBD,Select 3-5 highest-priority opportunities or keep as monitoring appendix.,"Treat as opportunity tracker, not a recommendation list."
Final PDF / slide publication gate,Review-gated / human approval required,"A living database can refresh, but executive / Board-facing claims should not update automatically without review.","Review queue closed, Appfigures/import caveats acknowledged, relationship fields reviewed.","review_queue_v3.csv, validation_pass_v3_2_1.csv, refresh_run_log_v3.csv",Executive / LST owner,Approve deck/report for discussion or hold for Appfigures/internal fields.,Use the deck as current-state discussion material; use workbook for proof.
